{
  "expertise": "INTERMEDIATE",
  "version": 1,
  "source": "medium",
  "authorIds": [
    "veroanggra"
  ],
  "author": "Veronica Putri Anggraini",
  "title": "Geofencing for boost your digital campaign",
  "link": "https://veroanggra.medium.com/geofencing-for-boost-your-digital-campaign-b890afe14dee",
  "tags": [
    "kotlin",
    "modern-android-development"
  ]
}
