{
  "expertise": "INTERMEDIATE",
  "version": 1,
  "source": "medium",
  "authorIds": [
    "aryanirani123"
  ],
  "author": "Aryan Irani",
  "title": "Transfer YouTube Statistics to Google Sheets using the YouTube Data API and Google Apps Script",
  "link": "https://aryanirani123.medium.com/transfer-youtube-statistics-data-to-google-sheets-using-google-apps-script-f8adab2103ed",
  "tags": [
    "developer-tools",
    "api-management"
  ]
}
