{
  "expertise": "INTERMEDIATE",
  "version": 1,
  "source": "other",
  "authorIds": [
    "gateremark"
  ],
  "author": "Mark Gatere",
  "title": "Python from the word ...Go (Pt2)",
  "link": "https://dev.to/gateremark/python-from-the-word-go-pt2-31k0",
  "tags": [
    "mobile",
    "nlp",
    "vision",
    "library",
    "notebook",
    "collection",
    "web",
    "theory"
  ]
}
