{
  "expertise": "INTERMEDIATE",
  "version": 1,
  "source": "other",
  "authorIds": [
    "wajahatkarim"
  ],
  "author": "Wajahat Karim",
  "title": "Beginner's Guide on ConcatAdapter in Android",
  "link": "https://wajahatkarim.com/2022/06/concat-adapter/",
  "tags": [
    "modern-android-development"
  ]
}
