{
  "expertise": "INTERMEDIATE",
  "version": 1,
  "source": "medium",
  "authorIds": [
    "nash0x7e2"
  ],
  "author": "Neevash Ramdial",
  "title": "Add location sharing to a messaging app using Flutter.",
  "link": "https://medium.com/@Nash0x7E2/add-location-sharing-to-a-messaging-app-using-flutter-2386bb18ef62",
  "tags": [
    "mobile",
    "general"
  ]
}
