{
  "expertise": "BEGINNER",
  "version": 1,
  "source": "other",
  "authorIds": ["idrisadeyemi01"],
  "author": "Idris Idris",
  "title": "How to integrate Firebase in a Flutter app using FlutterFire CLI",
  "link": "https://idrisadeyemi.hashnode.dev/integrating-firebase-to-your-flutter-app-using-flutterfire-cli",
  "tags": [
    "firebase",
    "mobile",
    "general"
  ]
}
