{
  "expertise": "BEGINNER",
  "version": 1,
  "source": "medium",
  "authorIds": [
    "adityathakurxd"
  ],
  "author": "Aditya Thakur",
  "title": "Open Source projects in Flutter",
  "link": "https://adityathakurxd.medium.com/open-source-projects-in-flutter-b6fa96f4d8fc",
  "tags": [
    "mobile",
    "plugins",
    "samples"
  ]
}
