{
  "expertise": "INTERMEDIATE",
  "version": 1,
  "source": "other",
  "authorIds": [
    "robertrobinson"
  ],
  "author": "Robert Robinson R",
  "title": "Flutter CI/CD Web host in Firebase using GitHub Action - Robert's Blog",
  "link": "https://robertrobinson.in/flutter-ci-cd-web-host-in-firebase-using-github-action/",
  "tags": [
    "mobile"
  ]
}
