{
  "expertise": "INTERMEDIATE",
  "version": 1,
  "source": "other",
  "authorIds": [
    "infiniteoverflow"
  ],
  "author": "Aswin Gopinathan",
  "title": "Create an API with Dart + Heroku",
  "link": "https://dev.to/infiniteoverflow/create-an-api-with-dart-heroku-477k",
  "tags": [
    "mobile",
    "plugins"
  ]
}
